o texto fala do que?	de uma cabeceira para cama	o texto fala do que?	de uma cabeceira para cama box
o texto fala do que?	cabeceira para camas
o material é bom?	sim
o material é bom?	sim, porque é feita de material resistente
o material é ruim?	não
é feita de que material?	de altíssima resistência
é feita de que material?	é feita de material de altíssima resistência
é feita de que material?	material resistente
o quarto fica lindo?	sim
o quarto fica feio?	não
o quarto vai ficar mais bonito?	sim
o quarto vai ficar mais feio?	não
qual a marca da cabeceira?	Bartira Versatti
Bartira Versatti é o que?	a marca da cabeceira
a cabeceira é para o que?	para uma cama box
uma cama box pode usar essa cabeceira?	sim
uma cama não box pode usar essa cabeceira?	não
uma cama box é uma móvel?	sim
uma cama box é linda?	somente a cabeceira é linda
a cama box é bonita?	a cabeceira é bonita
a cama box é prática?	a cabeceira é prática
a cama box é Bartira Versatti?	sim
essa cabeceira deixa o ambiente confortável?	sim
essa cabeceria deixa o ambiente seguro?	sim
o material é de alta resistência?	sim
o material é de baixa resistência?	não
o material é de péssima qualidade?	não
o material é de ótima qualidade?	sim
a qualidade do material da cabeceira é boa?	sim
a qualidade do material da cabeceira é ruim?	não
eu deveria perder essa oportunidade?	depende de suas necessidades
eu deveria aproveitar essa oportunidade?	depende de suas necessidades
a oportunidade é boa?	depende de suas necessidades
a oportunidade é ruim?	não
eu devo colocar agora mesmo no carrinho a cabeceira?	depende de seu julgamento
eu devo colocar agora mesmo no carrinho a cabeceira?	você decide
a cabeceira tem tomada?	sim
a cabeceria tem copos?	não
a cabeceira tem alta resolução?	não
a cabeceira tem amor?	não
a cabeceira é um cachorro?	não
a cabeceira é um móvel?	sim
a cabeceira é um imóvel?	não
faça uma descrição de um móvel	<|answer|>
faça uma descrição de uma cabeceira para cama box da marca Bartira Versatti	<|answer|>
preciso de uma descrição para uma cabeceira para cama box da marca Bartira Versatti	<|answer|>

